_id,url,title,article,summary,nlu.Concepts[0].name,nlu.Concepts[1].name,nlu.Location[0].name,nlu.Location[1].name,classification.isIncident,locations[0].address,locations[1].address,trfk_type.keys[0],trfk_subtype.keys[0]
5e8225050dc171d3c93e72ac,http://reliefweb.int/report/world/q-child-marriage-and-violations-girls-rights-14-million-girls-marry-each-year-worldwide,Q & A: child marriage and violations of girls' rights - 14 million girls marry each year worldwide - World,"What is child marriage?\n\nChild marriages occur when one or both parties are under the age of eighteen. The emerging consensus of international human rights standards is that the minimum age of marriage should be set at 18. A minimum age of marriage along with enforcement of a prohibition on forced marriage (irrespective of the age of either party) aims to protect both girls and boys from child marriage, although the practice affects girls more frequently and often coincides with other rights violations; including but not limited to domestic violence and impeded access to reproductive health care and education.\n\nHow many girls are affected by child marriage?\n\nEvery year 14 million girls are married worldwide. One in seven girls in the developing world is married before her 15th birthday – some as young as eight or nine. In 2010, over 67 million women ages 20-24 had been married as girls, and, if the trend continues, 142 million will be married by 2020.\n\nThe top twenty “hot spots” of child marriage, or countries with the highest prevalence, are: Niger, Chad, Bangladesh, Guinea, Central African Republic, Mali, Guinea, Nepal, Mozambique, Uganda, Burkina Faso, India, Ethiopia, Liberia, Yemen, Cameroon, Eritrea, Malawi, Nicaragua, Nigeria, and Zambia.\n\nOver 40 countries globally have a prevalence of child marriage of 30 per cent or higher. Two out of five girls are married as children in South Asia and Central and West Africa. Most of these girls are poor, less-educated, and living in rural areas.\n\nAbuses associated with child marriage Child marriages violate many human rights; including to education, freedom from violence, reproductive rights, access to reproductive and sexual health care, employment, freedom of movement, and the right to consensual marriage. The testimonies of the children and women Human Rights Watch has interviewed illustrate the profoundly detrimental impact on their physical and mental well-being, and their ability to live free of violence.\n\nConsequences of child marriage have lasting effects beyond adolescence as they struggle with the health effects of getting pregnant too young and too often, their lack of education and economic independence, domestic violence, and marital rape.\n\nHealth-related consequences Child marriage directly threatens the health and well-being of girls: complications from pregnancy and childbirth are the main cause of death among adolescent girls aged 15-19 in developing countries. Girls aged 15 to 20 are twice as likely to die in childbirth as those in their 20s, and girls under the age of 15 are five times as likely to die.\n\nThese consequences are due largely to girls’ physical immaturity where the pelvis and birth canal are not fully developed. Complications in labor are exacerbated where emergency obstetric services are scarce, as is the case in many societies where child marriage is prevalent.\n\nPregnancy for adolescent girls poses a serious risk of developing obstetric fistula, since their smaller pelvises make them prone to obstructed labor. Fistula leaves its victims with urine or fecal incontinence that causes infection, pain, and a bad smell.\n\nA child born to a girl under 18 has a 60 percent greater chance of dying in the first year of life than one born to a woman 19 and older.\n\nEducation-related consequences Child marriage frequently ends a girl’s education forever. Girls who marry young are often expected to take on responsibilities at home that are prioritized over attending school.\n\nA lack of education limits girls' choices and opportunities throughout their lives, not just when they are children. The price of this exclusion is often poverty. In Yemen, one girl who married at the age of 12 told Human Rights Watch:\n\nAll that I’m good for is to be a mother, and a home maker.... I’m illiterate. They didn’t teach us anything. If they did, at least I would have benefitted from something.\n\nWithout education, girls and adult women have fewer opportunities to financially provide for themselves and their families. Research shows how limited education may make girls and women more vulnerable to persistent poverty when their spouses die, abandon, or divorce them.\n\nViolence against married girls Married girls and young women between the ages of 15 and 19 with low levels of education are at a much greater risk of domestic and sexual violence from their spouses than older and more educated women. Research cites spousal age difference, typical of child marriage, as a significant risk factor associated with violence and sexual abuse against girls.\n\nMarital rape is common in South Sudan, although it is not recognized by law. One girl told us her husband raped her, aided by his brothers:\n\nI had refused to have sex with him, but he forced me. My brothers-in-law used to lock me up in the house during the day so that I don’t go anywhere, and so that I can have sex with him.\n\nAnother told Human Rights Watch that her husband physically, emotionally, and sexually abused her. She said:\n\nI had fibroids and was in a lot of pain. Sex was painful. If I told my husband I had pain, he would get out shouting that he was going to look for sex elsewhere because I had refused him. Sometimes he would have sex with me anyway.\n\nIn 2010, the case of Elham Mahdi Al-Assi, a 12-year-old girl in Yemen, caught international media attention when she died three days after she was married to a much older man. Her death was the result of severe bleeding caused by tears to her genital and anal area. Elham's mother told the Associated Press that her daughter had complained that her husband tied her up and raped her. This was after Elham’s mother warned her that failure to consummate the marriage would bring her family shame.\n\nNon-consensual sex can have especially devastating mental health consequences for young girls because they are at a formative stage of psychological development. Child brides also often face emotional abuse and discrimination in the homes of their husbands and in-laws. Confined to a home that may be removed from their hometown and familiar surroundings, they are isolated from friends and family.\n\nWhat happens when girls seek help after suffering violence in their marriage?\n\nInternational human rights standards recognize the right of women and girls to live free from physical, mental, and sexual violence. However, in many countries where child marriage is an accepted practice, governments also fail to criminalize domestic violence and marital rape. Girls in child marriages, already vulnerable due to their age and alienated due to their gender and low social status, are thus denied the protection from their governments they so greatly need.\n\nChild marriage is more prevalent in jurisdictions that generally offer fewer protections for women and girls. Yemen currently has no minimum age for marriage and girls of any age can and are being married. After her husband raped her, 11-year-old Reem al-Numeri in Yemen attempted to seek a divorce only to be told by the judge “we don’t divorce little girls.”\n\nWhere legal provisions do exist to protect girls from child marriage or related forms of violence, authorities often fail to enforce that protection or to prosecute perpetrators. Cases of domestic violence in Afghanistan show that many women and girls are afraid to seek help from justice or security departments because they fear further abuse or being forcibly returned home.\n\nRangina Y., married at the age of 13 in Afghanistan, explained her distrust for courts and judges. After running away from the physical and verbal abuse of her in-laws, she faced pressure from President Karzai, hostility from powerful members of parliament and extralegal arguments by the head of the Family Court to return to her husband. Rangina Y. told Human Rights Watch: “I don’t want to go back. I can’t go back. They want to kill me.” Failing to receive protection and enforcement of national marriage laws, women and girls in situations such as Rangina’s have little reason to trust the state or government to protect them.\n\nWhat happens when girls try to resist early marriage?\n\nGirls who refuse to accept or stay in forced marriages, or who elope because they want to marry someone not chosen or approved of by their families, are often at risk of violence, imprisonment, and in extreme cases, may be killed by their families or husbands.\n\nIn South Sudan, local women’s rights organizations pointed out to Human Rights Watch that society is generally tolerant of such punishment because the girl is seen as having gone against her family’s wishes and societal norms. As a result, perpetrators are rarely held to account, perpetuating a culture of violence against women in the country.\n\nOne South Sudanese girl, who married at 15, told Human Rights Watch that she was in year five of school and wanted to finish her education, but her uncles beat her and her mother to force her to marry a 75-year-old man:\n\nThis man went to my uncles and paid a dowry of 80 cows. I resisted the marriage. They threatened me. They said, “If you want your siblings to be taken care of, you will marry this man.” I said he is too old for me. They said, “You will marry this old man whether you like it or not because he has given us something to eat.” They beat me so badly. They also beat my mother because she was against the marriage.\n\nEleven girls Human Rights Watch spoke to in South Sudan said their families restricted their movements after they became engaged. One told Human Rights Watch:\n\nI am now confined at home. My family does not allow me to leave home because they think I will get another man…. I don’t even go to the market anymore or see my friends.\n\nAnother problem in protecting victims of forced marriage and enabling them to access justice is lack of coordination between relevant government ministries. For example, in South Sudan, Human Rights Watch documented that there are no guidelines on how the authorities should handle these cases, and ministries respond to cases in an ad hoc manner, often without offering any real solutions to the girls who go to them for protection. In the end, their inefficiency helps perpetuate child marriages and related abuses against girls.\n\nWhat work has Human Rights Watch conducted on child marriage?\n\nHuman Rights Watch has cited cases of child marriage in Bangladesh, Chad, Egypt, India, Iraq, Kenya, Papua New Guinea, Saudi Arabia, Syria, Uganda, and Uzbekistan, and interviewed women and girls who experienced child marriage in Afghanistan, Kyrgyzstan, Nepal, Yemen, and most recently South Sudan, where we found that almost half of the girls 15-19 were married.\n\nHow does Human Rights Watch recommend we end the practice of child marriage?\n\nGovernments can mitigate some of the worst abuses linked to child marriage by:","Over 40 countries globally have a prevalence of child marriage of 30 per cent or higher.\nAbuses associated with child marriage Child marriages violate many human rights; including to education, freedom from violence, reproductive rights, access to reproductive and sexual health care, employment, freedom of movement, and the right to consensual marriage.\nEleven girls Human Rights Watch spoke to in South Sudan said their families restricted their movements after they became engaged.\nWhat work has Human Rights Watch conducted on child marriage?\nHow does Human Rights Watch recommend we end the practice of child marriage?",Marriage,Human rights,Egypt,Syria,Article,Chad,Syria,Child Sexual Exploitation,Child Marriage
5e8226630dc171d3c93e73ae,"http://www.chicagotribune.com/news/local/suburbs/naperville_lisle/ct-tl-naperville-sexual-exploitation-20130624,0,635067.story",Man charged with child exploitation,"An Indiana man has been arrested for sexually exploiting a child following a three-month investigation by Naperville police.\nGregory A. Chambers, 26, is accused of sending sexually explicit pictures of himself to a 13-year-old relative and having inappropriate conversations with her, according to Sgt. Lou Cammiso.\nCammiso said the girl lives out of state, but the incidents occurred when she and Chambers were in the Naperville area in the spring visiting family.\nChambers was arrested June 21 in Whiting, Ind. where he lives in the 1500 block of 121st Street. He has been charged with two counts of sexual exploitation of a child and one each of grooming and electronic harassment. He is being held at the DuPage County jail.","An Indiana man has been arrested for sexually exploiting a child following a three-month investigation by Naperville police.\nCammiso said the girl lives out of state, but the incidents occurred when she and Chambers were in the Naperville area in the spring visiting family.","DuPage County, Illinois","Naperville, Illinois",Ind,Whiting,Incident,"Indiana, United States",,Child Sexual Exploitation,Sexual Servitude
5e8225570dc171d3c93e72e2,http://abcnewspapers.com/2013/06/17/former-blaine-resident-running-across-state-raising-awareness-for-human-trafficking-victims/,"Former Blaine resident running across state, raising awareness for human trafficking victims","by Eric Hagen\nStaff Writer\nA former Blaine resident and current St. Cloud State University student will be joining five others in running 230.2 miles across Minnesota June 23 to July 5 to raise awareness of the problem of forced-labor and sex trafficking.\nKatelyn Rabago said she knew ""little to none"" about human trafficking prior to hearing about it from RunFree representatives organizing the run from Watertown, S.D., to Stillwater.\nRabago was not an avid runner when she decided to join this run across Minnesota. The first time she timed herself running the mile at the start of her training in October 2012, she came in at 15 minutes. Two months later, she got her mile time down to eight minutes. Her best mile time is seven minutes, 12 seconds.\nWhen Rabago heard the statistics and a story from one woman from southeast Asia who was sold into sex trafficking in Europe for 18 years, she could not ignore the injustices.\n""It breaks my heart. I have broken down in tears. It's hard to put it into perspective for other people,"" Rabago said. ""Imagine the most beautiful, educated and kind woman stolen, drugged, beaten and raped for 18 years and then let free and imagine how they feel.""\nThe numbers can be hard to track. Lauren Ryan, program manager for anti-trafficking services for the International Institute of Minnesota, said the International Labor Organization estimates there are 20.9 million victims of sex and human trafficking throughout the world.\nRunFree estimates there are 27 million adults and 13 million children worldwide that are victims of human trafficking and approximately 75 to 80 percent of them are sold into sexual slavery and 80 percent are under the age of 24. Some are even as young as six years old. About 30,000 die each year from abuse, disease, torture and neglect.\nPart of the difficulty in identifying victims is that prostitution is illegal in some countries, including the U.S., so the women might not always be initially identified as sex slaves but thought of as prostitutes.\nLt. Bryon Fuerst of the Anoka County Sheriff's Office is heading up a new human trafficking task force between the sheriff's office and local police departments throughout the county to train officers how to look for and investigate this problem. He said police must interview prostitutes they arrest to determine if they were coerced and who did it.\nRyan said those victimized the most are runaway youth. Fuerst said the task force will work closely with school resource officers and homeless resource contacts inside schools and in the community, and rely on tips to learn about potential victims and perpetrators.\nThe six runners are coordinating with Venture Projects and RunFree to raise money to combat human trafficking in the southeast Asian countries of Burma and Thailand. Venture Expeditions is a Minneapolis-based nonprofit that organizes adventure-driven expeditions to raise awareness and funds for a variety of humanitarian causes.\nThe money will specifically go to The Just+Hope Campaign and Eden Women's Ministry.\nVenture Expeditions has shipped a million meals to people along the Burma-Thailand border who have been affected by the decades-long Burma Civil War.\nRabago said educating people over there about the dangers of human trafficking and how wrong it is must also continue to happen. Some fathers who need the money sell their daughters, so one way to shut down these camps is to give money to the family so they do not feel forced to sell their daughters to sex traffickers.\nNot an avid runner\nRabago said endurance, and not time, is the key when running an average of 17.7 miles over 13 days; two of those days will be 26-mile runs. The farthest she has run without taking a break is 20 miles.\nShe cut out sugar and a lot of fatty foods to give herself more energy, but a secret she learned from a friend was running long distances is mostly about having the right mind-set and pushing yourself even when you become exhausted.\n""It's a spiritual battle, emotional battle and physical battle you have to overcome,"" she said.\nRabago lived in Blaine from third grade through graduation. She earned her high school diploma two years early by the spring of 2009, but walked with her graduating class in 2011.\nShe grew up in a Christian home, but her dedication to her faith became stronger when she went to college, and she has been finding inspiration from Bible versus as she trains.\n""I feel like throughout my whole life, I've had so many trials and so many situations where I've been running and have fallen, but God has always been there to tell me to get up and finish the race,"" she said on her first video blog posted Nov. 20, 2012.\nTo find out more information or to donate, visit www.ventureexpeditions.org/page/run-free.\nEric Hagen is at\neric.hagen@ecm-inc.com","A former Blaine resident and current St. Cloud State University student will be joining five others in running 230.2 miles across Minnesota June 23 to July 5 to raise awareness of the problem of forced-labor and sex trafficking.\nKatelyn Rabago said she knew ""little to none"" about human trafficking prior to hearing about it from RunFree representatives organizing the run from Watertown, S.D., to Stillwater.\nRabago was not an avid runner when she decided to join this run across Minnesota.\nThe first time she timed herself running the mile at the start of her training in October 2012, she came in at 15 minutes.\nWhen Rabago heard the statistics and a story from one woman from southeast Asia who was sold into sex trafficking in Europe for 18 years, she could not ignore the injustices.\nIt's hard to put it into perspective for other people,"" Rabago said.\nLauren Ryan, program manager for anti-trafficking services for the International Institute of Minnesota, said the International Labor Organization estimates there are 20.9 million victims of sex and human trafficking throughout the world.\nRunFree estimates there are 27 million adults and 13 million children worldwide that are victims of human trafficking and approximately 75 to 80 percent of them are sold into sexual slavery and 80 percent are under the age of 24.\nLt. Bryon Fuerst of the Anoka County Sheriff's Office is heading up a new human trafficking task force between the sheriff's office and local police departments throughout the county to train officers how to look for and investigate this problem.\nThe six runners are coordinating with Venture Projects and RunFree to raise money to combat human trafficking in the southeast Asian countries of Burma and Thailand.\nVenture Expeditions has shipped a million meals to people along the Burma-Thailand border who have been affected by the decades-long Burma Civil War. Rabago said educating people over there about the dangers of human trafficking and how wrong it is must also continue to happen.\nThe farthest she has run without taking a break is 20 miles.",Minnesota,,,,Article,"Minnesota, United States",Myanmar,Child Trafficking,Illicit Activities
