_id,url,title,article,summary,nlu.Concepts[0].name,nlu.Concepts[1].name,nlu.Location[0].name,nlu.Location[1].name,classification.isIncident,locations[0].address,locations[1].address,trfk_type.keys[0],trfk_subtype.keys[0]
5e82308f0dc171d3c93e7a49,http://www.radionz.co.nz/news/world/216667/police-break-'human-trafficking-ring',Police break 'human trafficking ring',"Spanish and French police say they have dismantled a human trafficking ring that smuggled Chinese migrants into Europe and the United States.\n\nFifty-one suspects were arrested in Spain and 24 in France after a two-year joint investigation, a police statement said on Saturday.\n\nPolice said the main operatives were based in Barcelona.\n\nThey said traffickers charged €40,000 to €50,000 for each person to provide false identities and transport Chinese citizens to the US and countries such as Spain, France, Greece, Italy, the United Kingdom, Ireland and Turkey.\n\nIn some cases the ring was involved in the sexual exploitation of migrants, the statement said.\n\nSpanish police seized 81 fake passports from Asian countries such as Taiwan, South Korea, Malaysia, Japan, Hong Kong and Singapore.\n\nThe investigation into the ring began in July 2011. Police said the kingpin was in China and independent cells operated in different countries.","Spanish and French police say they have dismantled a human trafficking ring that smuggled Chinese migrants into Europe and the United States.\nFifty-one suspects were arrested in Spain and 24 in France after a two-year joint investigation, a police statement said on Saturday.\nIn some cases the ring was involved in the sexual exploitation of migrants, the statement said.\nSpanish police seized 81 fake passports from Asian countries such as Taiwan, South Korea, Malaysia, Japan, Hong Kong and Singapore.\nThe investigation into the ring began in July 2011.",European Union,Developed country,Ireland,Italy,Incident,United States,France,Sexual Exploitation,Sexual Servitude
5e82308f0dc171d3c93e79f7,http://www.thisdaylive.com/articles/human-trafficking-ring-broken-up/155979/,"'Human Trafficking Ring' Broken Up, Articles | THISDAY LIVE","Dozens of suspected people-traffickers have been arrested in Spain and France, suspected of smuggling Chinese migrants into Europe and US, police have said.\n 	The main bosses of the organisation, which was reportedly based in Barcelona, were among those arrested, reports the BBC.\n 	Some 81 fake passports from countries around Asia were seized.\n 	Police said the gang charged Chinese people more than 40,000 euros (£34,000; $53,000) to smuggle them to countries including the UK, Ireland and Turkey.\nPlease leave your comment below. Your name will appear next to your comment. We'll also keep you updated by email whenever someone else comments on this page. Your comment will appear on this page once it has been approved by a moderator.","Dozens of suspected people-traffickers have been arrested in Spain and France, suspected of smuggling Chinese migrants into Europe and US, police have said.\nPolice said the gang charged Chinese people more than 40,000 euros (£34,000; $53,000) to smuggle them to countries including the UK, Ireland and Turkey.",European Union,Spain,England,Turkey,Incident,France,United States,,Health/Beauty Services
5e82308f0dc171d3c93e79f1,http://www.dailymail.co.uk/news/article-2388669/75-arrested-human-trafficking-gang-charged-chinese-people-40-000-smuggle-europe.html?ito=1490&ns_campaign=1490,"75 arrested over human trafficking gang which charged Chinese people £40,000 to smuggle them into Europe","75 arrested over human trafficking gang which charged Chinese people £40,000 to smuggle them into Europe\n\nGang accused of offering false passports for Chinese citizens\n\nThey were smuggled into U.S, Britain, Spain and other European countries\n\nSome of those trafficked ended up in the sex trade\n\n51 people were arrested in Spain and 24 in France\n\n\n\nPolice in France and Spain have arrested 75 people who are accused of smuggling Chinese citizens into Europe and the U.S - with some being forced to work as prostitutes.\n\n\n\nSpain's Interior Ministry said today that 51 people were arrested in Spain and 24 in France as part of a two-year investigation.\n\n\n\nThe gang is accused of offering false passports for £40,000 to Chinese nationals who were then transported to the U.S., Britain, Spain, France, Greece, Italy and Turkey.\n\nScroll down for video\n\n\n\nInvestigation: A gang which allegedly smuggled Chinese citizens into the U.S and Europe - sometimes forcing them to work as prostitutes - has been raided by police, who made 75 arrests\n\nSome of the people trafficked ended up in the sex trade.The trafficking ring was based in China and the gang's main European hub was Barcelona airport.\n\n\n\nIt allegedly used the northeastern city as a stopping-off point for Chinese citizens while false documents were prepared.\n\nAccording to CNN , the arrests were made last June and the case, which is being heard at Spain's National Court, has been secret until now.\n\nThe suspects are Chinese, or from elsewhere in Asia and among those arrested include the two Barcelona-based suspected heads of the organisation in Europe.\n\nHeld: A police officer shows passports, stamps, identification cards, printers and mobile phones found after members of the gang were arrested\n\nPolice seized a total of 81 forged passports which were all made in China.\n\nThe passports were for Japan, Malaysia, Hong Kong, Singapore, South Korea and Taiwan.\n\nDetectives also found three laptops, printers and 22 rubber stamps, which police say were used to forge documents at homes.\n\nArrests: Police also found large amounts of cash as well as a gun. A total of 81 forged passports were also seized\n\nThe trafficking ring was highly organised to avoid detection with the smugglers keeping travelers under tight control.\n\n\n\nPolice said they would often try to pass them off unnoticed among groups of legitimate Chinese tourists.","Spain's Interior Ministry said today that 51 people were arrested in Spain and 24 in France as part of a two-year investigation.\nThe gang is accused of offering false passports for £40,000 to Chinese nationals who were then transported to the U.S., Britain, Spain, France, Greece, Italy and Turkey.\nIt allegedly used the northeastern city as a stopping-off point for Chinese citizens while false documents were prepared.\nThe suspects are Chinese, or from elsewhere in Asia and among those arrested include the two Barcelona-based suspected heads of the organisation in Europe.\nPolice said they would often try to pass them off unnoticed among groups of legitimate Chinese tourists.",Human trafficking,Smuggling,Taiwan,Malaysia,Incident,United Kingdom,France,Forced Criminality,Prostitution/Brothel/Escort Agency
5e82308f0dc171d3c93e79f0,http://www.news.com.au/world-news/europe-arrests-75-in-human-trafficking-ring-bust-chinese-migrants-paid-73000-for-new-identities/story-fndir2ev-1226694883555,"Europe arrests 75 in human trafficking ring bust; Chinese migrants paid $73,000 for new identities","SPANISH and French police said they have dismantled a human trafficking ring that smuggled Chinese migrants into Europe and the United States, arresting 75 suspects including ""main operatives"" based in Barcelona.\n\nFifty-one suspects were arrested in Spain and 24 in France after a two-year joint investigation, a police statement said.\n\nThe traffickers charged 40,000 to 50,000 euros ($58,000 to $73,000) per person to provide ""false identities and transport Chinese citizens to the United States and countries such as Spain, France, Greece, Italy, the United Kingdom, Ireland and Turkey,"" the statement said.\n\nIn some cases the ring was involved in the sexual exploitation of migrants, it added.\n\nSpanish police seized 81 fake passports from Asian countries such as Taiwan, South Korea, Malaysia, Japan, Hong Kong and Singapore.\n\nThe investigation into the ring described as ""complex"" began in July 2011.\n\n""The composition of this perfectly structured, hierarchical organisation, with its kingpin in China and independent cells operating in different countries, completely shut off from each other, complicated the investigation,"" the police statement said.\n\nThe traffickers accompanied their clients all the way from China to Spain, ""the last stop (serving as a) trampoline to the final destination, usually the United Kingdom or the United States,"" it said.","SPANISH and French police said they have dismantled a human trafficking ring that smuggled Chinese migrants into Europe and the United States, arresting 75 suspects including ""main operatives"" based in Barcelona.\nFifty-one suspects were arrested in Spain and 24 in France after a two-year joint investigation, a police statement said.\nIn some cases the ring was involved in the sexual exploitation of migrants, it added.\nSpanish police seized 81 fake passports from Asian countries such as Taiwan, South Korea, Malaysia, Japan, Hong Kong and Singapore.\nThe traffickers accompanied their clients all the way from China to Spain, ""the last stop (serving as a) trampoline to the final destination, usually the United Kingdom or the United States,"" it said.",European Union,Spain,Ireland,Italy,Incident,France,Greece,Sexual Exploitation,Health/Beauty Services
5e82308f0dc171d3c93e79ff,http://www.france24.com/en/20130810-human-trafficking-ring-busted-police?ns_campaign=editorial&ns_source=rss_public&ns_mchannel=rss&ns_fee=0&ns_linkname=20130810_human_trafficking_ring_busted_police,Police beak-up human trafficking ring,"French and Spanish police have arrested 75 suspects, including two Barcelona based ""main operatives"", allegedly part of a human trafficking ring that smuggled Chinese migrants into Europe and the US.\n\nAdvertising Read more\n\nSpanish and French police said Saturday they have dismantled a human trafficking ring that smuggled Chinese migrants into Europe and the United States, charging up to 50,000 euros per person.\n\nA total of 75 suspects including two ""main operatives"" based in Barcelona were arrested, including 51 in Spain and 24 in France after a two-year joint investigation, a police statement said.\n\nThe traffickers charged 40,000 to 50,000 euros ($53,000 to $66,000) per person to provide ""false identities and transport Chinese citizens to the United States and countries such as Spain, France, Greece, Italy, the United Kingdom, Ireland and Turkey,"" the statement said.\n\nIn some cases the ring was involved in the sexual exploitation of migrants, it added.\n\nSpanish police seized 81 fake passports from Asian countries such as Taiwan, South Korea, Malaysia, Japan, Hong Kong and Singapore.\n\nThe investigation into the ring, described as ""complex"", began in July 2011.\n\n""The composition of this perfectly structured, hierarchical organisation, with its kingpin in China and independent cells operating in different countries, completely shut off from each other, complicated the investigation,"" the police statement said.\n\nThe traffickers accompanied their clients all the way from China to Spain, ""the last stop (serving as a) trampoline to the final destination, usually the United Kingdom or the United States,"" it said.\n\nThe operatives, mainly from China and Malaysia, had the ""complete confidence"" of the ringleaders and were ""thorough connaisseurs of the European airports and cities along the route of the transfers,"" the statement said.\n\nOnce their mission was accomplished they would return home immediately, ""in order to make it more difficult to track them,"" police said.\n\nUpon the migrants' arrival in Barcelona, operatives of the trafficking ring would meet them and take them to safe houses before they embarked on the next leg of their journey.\n\nThe route taken from China, as well as the travel documents used, ""changed constantly according to the successes and failures of previous trips... or in order to prevent discovery of the traffickers,"" the statement said.\n\nThe migrants were given precise instructions on how to avoid detection at customs controls, such as trying to blend in with groups of tourists.\n\nThe two top suspects were arrested in Barcelona, while another 49 were picked up in Spanish airports including those of Barcelona, Madrid, Malaga and Mallorca, plus another 24 in France.\n\nThe 81 fake passports were found in two lodgings owned by the ring in Barcelona.\n\nThere police also found equipment for forging documents including portable computers, scanners, around 20 fake customs stamps and an electronic magnifier.\n\nPolice also provided pictures of a firearm, cellphones and wads of cash, both euros and yuan, that were seized in the operation.\n\nThe European Commission warned in a report issued in April that the problem of human trafficking was worsening across the bloc.\n\nIt signalled an 18 percent increase from 2008 to 2010 in identified and presumed victims of trafficking in the then 27-nation EU, with the total reaching 23,632.\n\nMore than half of the victims -- 61 percent -- were from EU nations, most often Romania and Bulgaria, with Nigeria and China as the most common countries of origin outside Europe.\n\nIn a 2010 report, the UN Office on Drugs and Crime described human trafficking as ""one of the most lucrative illicit businesses in Europe"", estimating gains through sexual exploitation and forced labour alone at around 2.5 billion euros per year.\n\n(AFP)\n\nDaily news briefReceive essential international news every morning Subscribe","French and Spanish police have arrested 75 suspects, including two Barcelona based ""main operatives"", allegedly part of a human trafficking ring that smuggled Chinese migrants into Europe and the US.\nAdvertising Read moreSpanish and French police said Saturday they have dismantled a human trafficking ring that smuggled Chinese migrants into Europe and the United States, charging up to 50,000 euros per person.\nUpon the migrants' arrival in Barcelona, operatives of the trafficking ring would meet them and take them to safe houses before they embarked on the next leg of their journey.\nThe 81 fake passports were found in two lodgings owned by the ring in Barcelona.\nThe European Commission warned in a report issued in April that the problem of human trafficking was worsening across the bloc.",European Union,Spain,Malaga,Bulgaria,Incident,Malaysia,"Mallorca, Illes Balears, Balearic Islands, Spain",Forced Criminality,Illicit Activities
5e82318d0dc171d3c93e7abe,http://sofiaglobe.com/2013/08/12/spain-france-raid-human-trafficking-ring/,"Spain, France raid human trafficking ring","Share this: Facebook\n\nTwitter\n\nLinkedIn\n\nReddit\n\n\n\nSpanish officials say 75 people have been arrested in a joint operation with French police against a people trafficking ring.\n\nThe Spanish Ministry of the Interior said Saturday that 51 people were arrested in Spain and another 24 in France in June, and that among those detained were two organizers of the Barcelona-based network. All of the suspects are Asian.\n\nAuthorities say the traffickers charged between $53,000 and $66,000 to supply Chinese citizens with false identities and paperwork, and transport them to the United States and several European countries. Police say the investigation of the complex operation took two years.\n\nSource: VOANews.com\n\n(Photo: foxumon/sxc.hu)\n\nComments\n\ncomments","Share this: FacebookTwitterLinkedInRedditSpanish officials say 75 people have been arrested in a joint operation with French police against a people trafficking ring.\nThe Spanish Ministry of the Interior said Saturday that 51 people were arrested in Spain and another 24 in France in June, and that among those detained were two organizers of the Barcelona-based network.\nAuthorities say the traffickers charged between $53,000 and $66,000 to supply Chinese citizens with false identities and paperwork, and transport them to the United States and several European countries.\nPolice say the investigation of the complex operation took two years.\nSource: VOANews.com(Photo: foxumon/sxc.hu)Commentscomments",United States,European Union,France,Kingdom of Spain (Napoleonic),Incident,France,United States,,Health/Beauty Services
5e82308f0dc171d3c93e7a14,http://www.bangkokpost.com/news/world/364012/human-trafficking-ring-broken-up-75-arrests-in-spain-france,"Chinese human trafficking ring busted in Spain, France","Chinese human trafficking ring busted in Spain, France\n\nSpanish and French police said Saturday they have dismantled a human trafficking ring that smuggled Chinese migrants into Europe and the United States, charging up to 50,000 euros per person.\n\nA handout picture released on August 10, 2013 by Spain's Interior Ministry shows suspected members of a gang allegedly smuggling Chinese migrants into Europe and the United States after they were arrested in Barcelona. Spanish and French police say they have dismantled a human trafficking ring that smuggled Chinese migrants into Europe and the United States, charging up to 50,000 euros per person.\n\nA total of 75 suspects including two ""main operatives"" based in Barcelona were arrested, including 51 in Spain and 24 in France after a two-year joint investigation, a police statement said.\n\nThe traffickers charged 40,000 to 50,000 euros ($53,000 to $66,000) per person to provide ""false identities and transport Chinese citizens to the United States and countries such as Spain, France, Greece, Italy, the United Kingdom, Ireland and Turkey,"" the statement said.\n\nIn some cases the ring was involved in the sexual exploitation of migrants, it added.\n\nSpanish police seized 81 fake passports from Asian countries such as Taiwan, South Korea, Malaysia, Japan, Hong Kong and Singapore.\n\nThe investigation into the ring, described as ""complex"", began in July 2011.\n\n""The composition of this perfectly structured, hierarchical organisation, with its kingpin in China and independent cells operating in different countries, completely shut off from each other, complicated the investigation,"" the police statement said.\n\nThe traffickers accompanied their clients all the way from China to Spain, ""the last stop (serving as a) trampoline to the final destination, usually the United Kingdom or the United States,"" it said.\n\nThe operatives, mainly from China and Malaysia, had the ""complete confidence"" of the ringleaders and were ""thorough connaisseurs of the European airports and cities along the route of the transfers,"" the statement said.\n\nOnce their mission was accomplished they would return home immediately, ""in order to make it more difficult to track them,"" police said.\n\nUpon the migrants' arrival in Barcelona, operatives of the trafficking ring would meet them and take them to safe houses before they embarked on the next leg of their journey.\n\nThe route taken from China, as well as the travel documents used, ""changed constantly according to the successes and failures of previous trips... or in order to prevent discovery of the traffickers,"" the statement said.\n\nThe migrants were given precise instructions on how to avoid detection at customs controls, such as trying to blend in with groups of tourists.\n\nThe two top suspects were arrested in Barcelona, while another 49 were picked up in Spanish airports including those of Barcelona, Madrid, Malaga and Mallorca, plus another 24 in France.\n\nThe 81 fake passports were found in two lodgings owned by the ring in Barcelona.\n\nThere police also found equipment for forging documents including portable computers, scanners, around 20 fake customs stamps and an electronic magnifier.\n\nPolice also provided pictures of a firearm, cellphones and wads of cash, both euros and yuan, that were seized in the operation.\n\nThe European Commission warned in a report issued in April that the problem of human trafficking was worsening across the bloc.\n\nIt signalled an 18 percent increase from 2008 to 2010 in identified and presumed victims of trafficking in the then 27-nation EU, with the total reaching 23,632.\n\nMore than half of the victims -- 61 percent -- were from EU nations, most often Romania and Bulgaria, with Nigeria and China as the most common countries of origin outside Europe.\n\nIn a 2010 report, the UN Office on Drugs and Crime described human trafficking as ""one of the most lucrative illicit businesses in Europe"", estimating gains through sexual exploitation and forced labour alone at around 2.5 billion euros per year.","Chinese human trafficking ring busted in Spain, FranceSpanish and French police said Saturday they have dismantled a human trafficking ring that smuggled Chinese migrants into Europe and the United States, charging up to 50,000 euros per person.\nA handout picture released on August 10, 2013 by Spain's Interior Ministry shows suspected members of a gang allegedly smuggling Chinese migrants into Europe and the United States after they were arrested in Barcelona.\nSpanish and French police say they have dismantled a human trafficking ring that smuggled Chinese migrants into Europe and the United States, charging up to 50,000 euros per person.\nUpon the migrants' arrival in Barcelona, operatives of the trafficking ring would meet them and take them to safe houses before they embarked on the next leg of their journey.\nThe European Commission warned in a report issued in April that the problem of human trafficking was worsening across the bloc.",European Union,Spain,Malaga,Bulgaria,Article,France,"Mallorca, Illes Balears, Balearic Islands, Spain",Forced Criminality,Illicit Activities
5e8231450dc171d3c93e7a86,http://www.business-standard.com/article/pti-stories/human-trafficking-ring-broken-up-75-arrests-in-spain-france-113081000439_1.html,"Human trafficking ring broken up, 75 arrests in Spain, France","Spanish and French police said today they have dismantled a human trafficking ring that smuggled Chinese migrants into Europe and the United States, arresting 75 suspects including ""main operatives"" based in Barcelona.\n\nFifty-one suspects were arrested in Spain and 24 in France after a two-year joint investigation, a police statement said.\n\nThe traffickers charged 40,000 to 50,000 euros (USD 53,000 to USD 66,000) per person to provide ""false identities and transport Chinese citizens to the United States and countries such as Spain, France, Greece, Italy, the United Kingdom, Ireland and Turkey,"" the statement said.\n\nIn some cases the ring was involved in the sexual exploitation of migrants, it added.\n\nSpanish police seized 81 fake passports from Asian countries such as Taiwan, South Korea, Malaysia, Japan, Hong Kong and Singapore.\n\nThe investigation into the ring described as ""complex"" began in July 2011.\n\n""The composition of this perfectly structured, hierarchical organisation, with its kingpin in China and independent cells operating in different countries, completely shut off from each other, complicated the investigation,"" the police statement said.\n\nThe traffickers accompanied their clients all the way from China to Spain, ""the last stop (serving as a) trampoline to the final destination, usually the United Kingdom or the United States,"" it said.","Spanish and French police said today they have dismantled a human trafficking ring that smuggled Chinese migrants into Europe and the United States, arresting 75 suspects including ""main operatives"" based in Barcelona.\nFifty-one suspects were arrested in Spain and 24 in France after a two-year joint investigation, a police statement said.\nSpanish police seized 81 fake passports from Asian countries such as Taiwan, South Korea, Malaysia, Japan, Hong Kong and Singapore.\nThe investigation into the ring described as ""complex"" began in July 2011.\nThe traffickers accompanied their clients all the way from China to Spain, ""the last stop (serving as a) trampoline to the final destination, usually the United Kingdom or the United States,"" it said.",European Union,United States,Ireland,Italy,Incident,France,Greece,Sexual Exploitation,Sexual Servitude
