_id,url,title,article,summary,nlu.Concepts[0].name,nlu.Concepts[1].name,nlu.Location[0].name,nlu.Location[1].name,classification.isIncident,locations[0].address,locations[1].address,trfk_type.keys[0],trfk_subtype.keys[0]
5e822a1f0dc171d3c93e75f2,http://www.dailymail.co.uk/news/article-2377771/town-warning-boys-12-13-cautious-horrible-pedophile-sex-offender-getting-jail-friday.html,Town warning boys 12-13 to be cautious as horrible pedophile sex offender is getting out of jail on Friday,"Vermont on edge as officials warn boys aged 12-13 to be on alert as pedophile rapist is getting out of jail on Friday\n\nBlond-haired, blue-eyed boy aged 12-13 considered at highest risk\n\nTimothy Szad will not be on parole but is required to notify state where he lives\n\nSzad's parents went back on plans to allow him to move into their house after public outcry\n\nVermont authorities are warning residents in advance of a high-risk pedophile being released from prison Friday.\n\nResidents are being told to be extra cautious with their children as a high risk pedophile is set to be released from a state prison Friday, with 12 to 13-year-old blond-haired, blue-eyed boys said to be at highest risk, according to reports.\n\n' It's terrible they're letting him out. Once a pedophile, always a pedophile ,' Springfield, VT. resident Jamie Hooper said.\n\nPervert: Timothy Szad received a 13-year setnece after admitting to carrying a 13-year-old autistic boy across a river, handcuffing and repeatedly sexually assaulting him, he will be released from prison Friday\n\nTimothy Szad, 53, was sentenced to 13 years in prison after handcuffing and repeatedly sexually assaulting a 13-year-old autistic boy in 2000. With his sentence coming to an end Friday, authorities are warning the public he is at risk for re-offending, according to reports.\n\n\n\nSzad is required to notify the state of where he chooses to live, but he will not be under supervision.\n\nThe pedophile received his sentence after agreeing to a plea deal that spared the boy from having to testify to Szad grabbing him, carrying him across a river, handcuffing and sexually assaulting him multiple times, according to the Burlington Free Press .\n\n\n\nSzad admitted to these acts in exchange for a lighter sentence than the maximum 20 years he would have faced if the case went to trial, the paper reported.\n\n\n\nDespite taking part in a sex offender treatment program, prison officials determined Szad is at high risk to offend again, according to reports. His most likely target would be blonde haired, blue eyed boys 12 to 13-years of age.\n\n\n\nAuthorities’ efforts to notify the public in advance of the pervert being released have scuttled plans he had to move in with his parents, according to reports, leading to him potentially being homeless.\n\n\n\n‘I wouldn't want him in my neighborhood. I don't think that you or anybody else would,’Rep. Kurt Wright, (R-Burlington) told WCAX .\n\n\n\nSzad’s case is renewing the push for Vermont to pass a civil confinement law meant to keep sex offenders with an inability to control their impulses off the streets indefinitely through confinement in a mental institution, according to reports.\n\nDespite the concern caused by Szad's release, he does have his defenders, including the American Civil Liberties Union.\n\n' We live in a society that operates by the rule of law ,' Allen Gilbert, executive director of the ACLU's Vermont chapter, said, adding ' courts have determined the appropriate sentence for him, he's served his sentence, and now he's getting out .'\n\nAnother resident nearby the Springfield prison Szad is set to be released from expressed hope he would emerge a reformed man.\n\n' Hopefully if he's coming here, he'll commit to living a decent life ,' Russell Hill said.\n\nStranger danger: Vermont officials are warning residents in advance of Szad's release from this Vermont prison, saying that 12 to 13-year-old blond haired, blue eyed boys are at highest risk of abuse by Szad\n\nThe state legislature rejected passage of a civil confinement measure in 2007, citing the expense and high burden of proof needed to indefinitely commit an individual such as Szad, reports said.\n\n\n\n‘I don't know whether the Legislature would be willing to go down that path. I've always believed it was a mistake not to pass it,’ Wright continued.\n\n\n\nVermont Governor Peter Shumlin (D) told WCAX that he would strongly consider signing such a measure if passed by the state legislature, adding that he’s for ‘anything that the Legislature and we can do to make this state safer from pedophiles.’\n\nAndy Bladyka, Springfield director of parks and recreation, said he had been consulting with the police chief and town manager about Szad's release, but as of Wednesday, no special precautions were being planned within Springfield's summer youth programs.\n\nOn alert: Several small town in Vermont, such as Springfield, where the prison Szad will be released from is located, are being warned to be more careful with their children after the convicted pedophile is set free Friday\n\nSmall town USA: Springfield, which was named the official hometown of the Simpsons and in 2007 hosted the animated movie's premiere, are being told by officials to look out for Timothy Szad\n\nHe said staff and volunteers are already trained with security in mind. For example, he said, they are told not to leave a child alone after a program but to ensure that each one has safe transportation home.\n\n20 states, including New York and New Hampshire, currently have civil confinement measures in place.\n\nIn a New York courtroom on Tuesday, former New York Gov. George Pataki defended himself in a lawsuit brought by six convicted sex offenders who said their constitutional rights were violated under a civil commitment law initiated by Pataki.\n\nState Rep. Alice Emmons, a Springfield lawmaker who chairs the House committee that oversees Vermont's prisons, said she opposes civil commitment laws.\n\n""You're holding someone who has not committed a (new) crime. Do we as a society in Vermont want to do that?"" she asked.","Once a pedophile, always a pedophile ,' Springfield, VT. resident Jamie Hooper said.\nWith his sentence coming to an end Friday, authorities are warning the public he is at risk for re-offending, according to reports.\nSzad is required to notify the state of where he chooses to live, but he will not be under supervision.\nDespite taking part in a sex offender treatment program, prison officials determined Szad is at high risk to offend again, according to reports.\nAnother resident nearby the Springfield prison Szad is set to be released from expressed hope he would emerge a reformed man.'",Sex offender,Civil liberties,VT.,New Hampshire,Incident,"New York, United States","New Hampshire, United States",Child Sexual Exploitation,Amusement and Recreation
5e822a1f0dc171d3c93e75fe,http://rapidcityjournal.com/news/latest/spain-police-arrest-hells-angels-for-human-and-drug-trafficking/article_6f6f4349-8d67-527c-a7b8-d9283454793f.html,Spain police arrest 25 Hells Angels for human and drug trafficking,"A police statement issued Wednesday said the group's alleged European leader, German citizen Frank Hanebuth, was among those detained in 31 house raids.\nPolice said the 25 were wanted for suspected drug trafficking, trafficking in human beings, extortion, money laundering and corruption.",,Hells Angels,Organized crime,Austria,Germany,Article,Spain,,,Illicit Activities
5e8229ad0dc171d3c93e75bb,http://www.spyghana.com/zabzugu-and-tatale-now-transit-point-for-human-trafficking/,Zabzugu and Tatale Now Transit Point For Human Trafficking | News Ghana,"The Eastern Corridor of the Northern Region, particularly areas around Zabzugu and Tatale, is fast becoming a transit point for human trafficking activities.\nAccording to statistics made available by the Domestic Violence and Victims Support Unit (DOVVSU) of the Ghana Police Service, 18 people aged between four and 19 were trafficked to neighbouring countries such as Mali, Togo and Nigeria by a syndicate operating in the area in 2012 alone.\nIn 2010, two cases were recorded in the Walewale area.\nHowever, due to intensive surveillance being mounted by the police and other stakeholders, it appears the activities of the group are being frustrated.\nCommunities along the Eastern Corridor  include Saboba, Chereponi, Yendi, Gushiegu, Salaga and Nanumba South and North districts.\nThe DOVVSU, with support from the Department of Social Welfare and Recfam, a local non-governmental organisation, has been able to reintegrate 30 children who were previously trafficked along the Zabzugu/Tatale area into their respective families and communities.\nAs a result of the intensive surveillance to stem the tide, two suspects who were allegedly involved in human trafficking at Tatale under the pretext of offering their victims jobs in Nigeria were arrested by the Northern Regional Police Command on June 19, 2013.\nIssah Yakubu, 26, and Abdul Karim Habib, 29, were said to have so far trafficked 18 Ghanaians, mainly children, to Nigeria.\nTheir modus operandi is to persuade their victims into believing that when they are sent to Nigeria they will be offered jobs which could enable them to buy motorbikes within a relatively short time.\nThe Regional Crime Officer, Superintendent of Police Alhaji Arhin Mahama, told The Mirror in Tamale that the police, upon a tip-off, mounted surveillance on the suspects.\nHe explained that Yakubu and Habib, in their latest operation, had completed arrangements and succeeded in trafficking three Ghanaians to Nigeria before they were arrested by the police.\nThe names of two of the victims were given as Seidu Yahaya and one Osman but the name of the third victim is yet to be known.\nThe officer said when Yakubu and Habib were questioned, they admitted committing the offence and added that they had an accomplice called Annan who traffics the victims  to Nigeria.\nYakubu and Habib, according to Alhaji Mahama, gave the phone number of the accomplice to the police who in turn called the number and spoke to the victims.\nThey (the victims) allegedly lamented about the deplorable situation they found themselves in Nigeria.\nThe Mirror also gathered that in recent times human trafficking in Tatale is increasing partly because the area is close to the Togo border.\nThe United Nations Children?s Fund (UNICEF) and the International Labour Organisation (ILO) estimate that between 200,000 and 300,000 children are trafficked each year for forced labour and sexual exploitation in West and Central Africa.\nIt has been observed that the figures might be higher, since there is no reliable data due to various reasons such as the underground and illegal nature of human trafficking, the lack of anti-trafficking legislation in some African countries and the reluctance of the victims to report their experiences to the authorities.\nAccording to the Regional Coordinator of DOVVSU, Assistant Superintendent of Police (ASP) Emmanuel Holortu, parental neglect, inability of parents to control their children, poverty and broken homes are some of the major causes of human trafficking along the corridor.\nHe said most of the victims, who were mainly children, fell prey to those engaged in that criminal act partly because their parents were divorced and had entered into new relationships, hence they were exposed as there was no care for them.\nHe further revealed that in the case of a particular four-year-old boy who was trafficked to Mali, his own father gave him out to the traffickers.\nThe DOVVSU Regional Coordinator once again observed that these victims, particularly the girls, suffer from all forms of abuse, including the fact that some of them are used as sex slaves or for prostitution while their male counterparts are engaged in menial jobs.\nASP Holortu was of the view that there must be effective monitoring and surveillance to clamp down on the activities of the syndicate, noting that a lot of activities had been put in place in collaboration with non-governmental organisations to nip the practice in the bud.\nSource: The Mirror","The Eastern Corridor of the Northern Region, particularly areas around Zabzugu and Tatale, is fast becoming a transit point for human trafficking activities.\nAccording to statistics made available by the Domestic Violence and Victims Support Unit (DOVVSU) of the Ghana Police Service, 18 people aged between four and 19 were trafficked to neighbouring countries such as Mali, Togo and Nigeria by a syndicate operating in the area in 2012 alone.\nThe DOVVSU, with support from the Department of Social Welfare and Recfam, a local non-governmental organisation, has been able to reintegrate 30 children who were previously trafficked along the Zabzugu/Tatale area into their respective families and communities.\nAs a result of the intensive surveillance to stem the tide, two suspects who were allegedly involved in human trafficking at Tatale under the pretext of offering their victims jobs in Nigeria were arrested by the Northern Regional Police Command on June 19, 2013.\nYakubu and Habib, according to Alhaji Mahama, gave the phone number of the accomplice to the police who in turn called the number and spoke to the victims.\nThe Mirror also gathered that in recent times human trafficking in Tatale is increasing partly because the area is close to the Togo border.\nAccording to the Regional Coordinator of DOVVSU, Assistant Superintendent of Police (ASP) Emmanuel Holortu, parental neglect, inability of parents to control their children, poverty and broken homes are some of the major causes of human trafficking along the corridor.",Human trafficking,Crime,Central Africa,Mali,Incident,"Northern Region, Northern, Ghana",Togo,Child Trafficking,Illicit Activities
5e822a9e0dc171d3c93e7638,http://timesofindia.indiatimes.com/city/hyderabad/labour-officials-rescue-girl-child-worker/articleshow/21409421.cms,Labour officials rescue girl child worker,"This story is from July 28, 2013\n\nHYDERABAD:\n\non Saturday rescued a 13-year-old child worker from a flat at Shantinagar and shifted her to the State Home for Girls, Nimboliadda.\n\nDownload The Times of India News App for Latest City News\n\nSubscribe Start Your Daily Mornings with Times of India Newspaper! Order Now\n\nAccording to the officials, on the information provided by AP Balala Hakkula Sangham, a raid was conducted on flat no. 302, Bramana Towers in Shantinagar. The officials found a 13-year-old girl child employed there.On interrogating the girl, she said that the house owner had employed her for looking after an infant, who was the employer's grandson.However, house owner C Durga claimed the girl's parents themselves left the girl at her house. She denied employing the minor.The rescued girl was unaware about the wages being paid by the employer to her. The girl hails from Cheryala of Warangal district.","This story is from July 28, 2013HYDERABAD:on Saturday rescued a 13-year-old child worker from a flat at Shantinagar and shifted her to the State Home for Girls, Nimboliadda.\nDownload The Times of India News App for Latest City NewsSubscribe Start Your Daily Mornings with Times of India Newspaper!\nOrder NowAccording to the officials, on the information provided by AP Balala Hakkula Sangham, a raid was conducted on flat no.\nThe officials found a 13-year-old girl child employed there.On interrogating the girl, she said that the house owner had employed her for looking after an infant, who was the employer's grandson.However, house owner C Durga claimed the girl's parents themselves left the girl at her house.\nShe denied employing the minor.The rescued girl was unaware about the wages being paid by the employer to her.",Broadsheet,Employment,Nimboliadda,Cheryala of Warangal,Incident,"Warangal, Telangana, India",,Child Trafficking,
5e822a610dc171d3c93e7622,http://sunnewsonline.com/new/cover/police-nab12-suspected-human-traffickers-rescue-55-children/,"Police nab12 suspected human traffickers, rescue 55 children - The Sun News","Benue State Police command yesterday paraded 12 suspected human traffickers just as it rescued 55 children from them along Otukpo – Enugu road. The traffickers, according to the state Commissioner of Police, Adams Audu, were in the business of cajoling unsuspecting parents to release their children and wards to them with the assurance that they would give them better future.\nAudu while parading the suspects yesterday said his men apprehended seven of the suspects travelling in a convoy of three mini buses on Monday at a check point on Otukpo highway while the remaining five were arrested from different locations in the state.\nHe noted that the eagle eyed security operatives discovered during their search of the intercepted vehicles a total of 55 persons, including 17 children between the ages of five and 17 years.\nMike and Phillip Adema Adegu said upon interrogation, they confessed to the crime.\nOthers who were later apprehended include, a couple, Mr. and Mrs. Yamuer Maashin, Messrs Tarchill Tyotyev and Tyodoo Yamuer all of Kastina-Ala locality and the chief trafficker, Chigozie Amechi who operates from Port Harcourt, Abuja and Lagos.\nAccording to the police boss, the suspects said they got the children from Oju Local Government Area of Benue State and Yala Local Government Area of Cross Rivers State.\nAccording to Audu, the suspects were transporting the children to Lagos for undisclosed mission.\nHe said the parents of the victims were mostly unaware that they are to be given out to strangers who would subject them to child labour, prostitution and hawking among others.\nAmechi is said to be making above N400, 000 monthly from innocent beggars he sent to the streets of Lagos while Tyotyev and Yamuer are the liaison of syndicate who collude with parents to send their little children for begging and prostitution in urban areas.\nAnswering questions from newsmen, an elderly suspect, Edwin Onah denied doing the illicit business, but admitted giving out his daughter, Helen who was among the rescued children to one Dominic for onward transfer to Lagos to live with her elder sister.\nMeanwhile, the police commissioner who stated that he had ordered full scale investigation into the matter advised members of the public to avail the command of any ungodly and inhuman practises so that the perpetrators can be brought to face the full wrath of the law.\nAre you an unemployed person’s in Nigeria? Or have u ever dreamt of makin money through the internet? Then grab this opportunity & to overcome all ur Financial problem, i have made upto N75,000 directly into my Nigerian Ecobank account doing this great business, right from the comfort of my home with my Nokia 5130 xpress music, and with only a capital N1500 one time payment that i paid for my Activation 100%guarantee, this is the best and number one internet business empowerment in Nigeria, to know how this rare business works and how to get started click the link below for details, and please don’t be too excited to take action without reading this Free Report to the end \nIts not enough for the security agents to arrest/parade Nigeria ns for offences,which often times ended up,with the innocent and the guilty ones being dumped in the prisons accross the Country for upward of 5 or IO yrs,more than the stipulated jail terms, if tried& found guilty in the surposed competent law courts of the land.Therefore, I wish to use forum to call on NBA & Human right groups in Naiga  to rise to up this challenges & all forms of injustices being meted against poor Nigerians,by the  Security agents,Prison authorities and Judicial system,such as the recent case of Nigerians who were released by the Chief Judge of Ebonyi State after more than Five(5 ) to Ten (IO) full years on AWAITING TRIAL in the State prison yard,and many other parts of the Country. While known corrupt criminals are left untouched by the same National security agents that clamped/often torture fellow Nigerians wt minor offences to their untimely deaths, only to be burried in shallow graves,while some were dumped into the Rivers,like raw materials.WITHER MY FELLOW NIGERIANS ? WELL GOD DEY,NA POOR MANS,PRAYER.!! BUT ONE MONKEY GO-GO CHURCH,INGO COME BACK,In Jesus Name!!!","Benue State Police command yesterday paraded 12 suspected human traffickers just as it rescued 55 children from them along Otukpo – Enugu road.\nThe traffickers, according to the state Commissioner of Police, Adams Audu, were in the business of cajoling unsuspecting parents to release their children and wards to them with the assurance that they would give them better future.\nAudu while parading the suspects yesterday said his men apprehended seven of the suspects travelling in a convoy of three mini buses on Monday at a check point on Otukpo highway while the remaining five were arrested from different locations in the state.\nAccording to the police boss, the suspects said they got the children from Oju Local Government Area of Benue State and Yala Local Government Area of Cross Rivers State.\nIts not enough for the security agents to arrest/parade Nigeria ns for offences,which often times ended up,with the innocent and the guilty ones being dumped in the prisons accross the Country for upward of 5 or IO yrs,more than the stipulated jail terms, if tried& found guilty in the surposed competent law courts of the land.Therefore, I wish to use forum to call on NBA & Human right groups in Naiga  to rise to up this challenges & all forms of injustices being meted against poor Nigerians,by the  Security agents,Prison authorities and Judicial system,such as the recent case of Nigerians who were released by the Chief Judge of Ebonyi State after more than Five(5 ) to Ten (IO) full years on AWAITING TRIAL in the State prison yard,and many other parts of the Country.",Nigeria,Security,Ebonyi,Ala,Incident,"Port Harcourt, Port-Harcourt, Rivers, Nigeria","Abuja, Municipal Area Council, FCT, Nigeria",Child Trafficking,Forced Begging
